1 - 2 years;"* contains any test    * no need to catch coverage - better high level tests instead of testing all details and duplicating the module itself)    * usage of other modules for some tasks (database, alternatives, ...) - less copying of the code and better reuse    * exec usage: prefer other constructs instead (although execs doesn't necessary mean bad code)    * sometimes custom functions or facts in the ruby are better    * do not call classes with parameters inside the code    * (it is OK to be called this way for ""internal"" classes though)    * (it is OK in the examples or roles)    * module is available at the puppet forge";* not documenting usage of the module    * forcing users to use specific puppet feature (direct hiera calls, inventory is hard to setup, ...);"* usable and well documented (doesn't need to have simple usage, if there are examples)    * if it works rather quickly without much fights and experimenting    * if there are more options what to do with it (custom variables to apache configurations, custom properties for tomcat, ...)    * interesting features (for example JDBC installation in puppetlabs MySQL/PostgreSQL, mysqltuner script installation, ...)    * quick look to the code (for example adrien/alternatives module is awesome: just four ruby files providing all resources needed)    * official puppeptlabs modules have slightly higher priority    * if there are NOT incorporated too many things (hardcoded java installation of specific version/implementation, database installation, ...); This goes partially against the recommended best practices saying ""module should be as self-contained as possible"". :-)    * some recent release (<= two years?), some recent commits (<= one year?)";* I don't distinguish much between class parameters and hiera, so for me it is more question what to parametrize and what do not    * more parameters for low-level modules (package name, ensure parameter for services, ...)    * OS specific defaults doesn't need to be always parametrized (but low-level modules would need that too - they may be used in non-standard platforms, ...);"* limitation on the single node: I would need some whole-cluster-wait for something before continuing the setup, or whole-cluster setup stages    * repeating parameters in all public classes: I'm rather using no-operation main configuration class instead (I guest the recommended best practice is to use only the main class for everything?)    * multiple installation of the same package is problematic (I'm trying to use ensure_package() from stdlib module as workaround)    * package ensure parameter:    * I don't care if the package is 'held' or 'installed' (puppet requires the exact state)    * 'held' can't be combined with the version    * stability of puppet language: they sometimes literally change false to true (testing for undef or empty string is the nightmare ;-))    * distribution of the puppet itself: the new packaging incorporate even java and ruby, which shuld go from the OS instead (but it is more about puppet itself, not about programming)"1 - 2 years;Cleanness, expandability, code conventions, testing;Reinvent the wheel.;Cleanness, expandability, code conventions, testing;Things that changes goes into Hiera.;The biggest issue is the lack of best practices for the toolset.1 - 2 years;Whether it actually works ... hard to tell unless you try it.;Poor implementation, e.g. unreliable, lack of configurability.;"Coming from ""official"" source, date last updated, compatible puppet version, documentation.";Good question.;Non-determinism, impurity, poor quality modules, complexity induced by cross-platform support  (I only want Linux), changes in the syntax and api, puppet syntax is weird and ugly, pretty poor api documentation (e.g. types documentation), module distribution, use of ruby, it's slow to apply changes, much more...Less than one year;Efficient use of variables, proper care of flow if modules are interdependent, documentation.;1. Not keeping check of dependent modules (those which needs to be executed first than others).  2. Redundant code doing same things.  3. Too many classes.;The quality of module, feedback from people/web/blogs about different modules and the support available.;If something is confidential (password/users/keys), we generally put it in hiera since hiera is not kept with code and never committed upstream.  If a variable needs to be passed at multiple locations and we want to change its value for one specific instance, we try to overwrite the default value by specifying it in hiera rather than passing everywhere.;Documentation examples. Online documentation does tell about the functionality, but lacks examples.3 - 4 years;"length (number of lines)  ""colors"" of code in my IDE (to see if there are lots of hard coded texts in the code, or if variable are used  variables provided for the ""class""  check if create_resources is used (if used, much more concise code)  ...";Trying to be compatible with all the OSes, because it lead often to high complexity;If possible, I do not use puppet module. Lots of them are very poor quality, and try to be compatible with lots of operating system, which is not a need for me (and for lots of us), because, often, we try to choose a platform stack (debian, ...) and have all of our servers installed with this stack. In this case, this is not really useful to be compatible with other stacks/os, and difficult to be optimized with all.;"By answering the question : ""If I use this class for an other customer/project, do I need to update it or is it ready yet just using configuration via Hiera""";order of execution  time of execution if you do not take of reducing the number of modulesMore than 5 years;Consistency and integration points, the ability to extend the module with on-site specific code without changing the module itself, a good example is the example42 module base as it provides all the required knobs to fit them perfectly onto a specific on-site infrastructure while promoting re usability and non intrusive features;mots modules provided by puppetlabs as they are to opinionated for real life usage ;integration and extendability, is there an optional integration point provided for firewalling / selinux / monitoring ? are the basics done ? are the required features supported ?;"everything thats pure ""data"" should go into hiera, only complicated structures should go into puppet code, for example if you need to make decisions based on multiple facts if a resource is generated or not";"error reporting and validation of code / data in a multi dc, multi continent setup which tend to get complicated where quickly. validation is the biggest pain point here, especially when you are also doing a fair share of hiera cross lookups, tools like kwalify can help you here but are not ""there yet"""More than 5 years;Module/file organisation, linting, behaviour;Not allowing to disable management of repositories or other parts that could be handled by other modules, preventing interoperability between modules from multiple providers;Code quality/cleanness, number of stars and forks, activity, documentation...;"Has much as posssible, everything that is ""configuration"" either targetting all the infrastructure or  only one part";multiple incompatible modules of different quality. No clear good practice/standard on module organisation (like things like params.pp and other patterns)3 - 4 years;puppet-lint compliant, puppet validated to be sure it functions and if it meets the PCS pattern of Ken Barber: http://www.slideshare.net/PuppetLabs/modern-module-development-ken-barber-2012-edinburgh-puppet-camp;Not following the PCS pattern for starters, not using default values of parameters, enforcing people to use for example managed_repos by setting it default to true (should be false by default) using explicit hiera calls! and therefore forcing people to use hiera;meets PCS have sane default params;data -> hiera;deciding roles/profiles/hiera data3 - 4 years;Documentation and Unittests. Also for the supported platforms. How modular it was build. ;Simple puppet that just changes a single thing without any possibility of change. ;How simple I can integrate it into a existing environment. It should be possible without a change to the existing environment.;"I'm not using hiera yet ;( ";Out-date code in a legacy environment. As well the problem of puppet not able to handle to complex setup (ceph problem)Less than one year;I would think structuring. If they are using classes correctly. If they are using native puppet functions rather than trying to do things using command line commands.   ;Most ;I haven't yet. ;I don't;If you're setting up cron jobs, it's impossible to actually test what puppet does. Also, I've had times where puppet has added new cronjobs, but not removed old ones - the issue happens when you change the name of a cronjob. More than 5 years;parsing puppetlint .. readability, modularity ;failing at lint ,  no use of modules , hardcoding params,  no use of subclasses,  no use of profiles,   lack of upstream modules in the tree,  failing to have a pipeline for the code ;support for Distros, modularity , use of OS packages ,  ;sane defaults vs configuratble data,   ;3 - 4 years;- number of exec resources  - number of if statements  - number of class declarations by 'class resource'  - number of 'vampire features' used (i.e. obscure features that generally are hardly used, '+>' operator is an example)  - usage of custom types  - reliance on resource defaults  - usage of metaparameters ('require', etc)  - usage of third party modules  ;"- exec resources without 'stop condition'; they trigger a modification action on each puppet run  - class declarations as a resource, where 'include' would have been sufficient";- time since latest release (not too old)  - puppet forge quality rating (although admitted that doesn't say a lot)  - author (I trust some others more than others, 'puppetlabs' for example)  - if the actual code is still on github  - if all parameters are documented  - how many downloads the module has (more is better)  - I usually quickly skim through the code to get a feel for if it would fit in our codebase;Data that is likely to be modified during its lifetime goes in hiera. Data that is not likely to be modified is ok to put in puppet.;writing modules for applications that don't lend themselves too well for puppetizing. For example, some applications don't offer command-line configuration (i.e. you're expected to do configuration in a browser - this hard if not impossible to puppetize).